{
  "event": "downloads:complete",
  "message": "Download en.yml is ready in project Translation Project within branch new-feature-1: https://downloads.example.com/2025/02/07/a/b/ab12cd34ef56ab12cd34ef56ab12cd34?Expires=1739032800&Signature=example&Key-Pair-Id=EXAMPLE",
  "sent_at": "2025-02-07 16:44:04 UTC",
  "user": {
    "id": "24b9a53ad72e198ca332fba91bb95f57",
    "username": "john.smith",
    "name": "John Smith",
    "gravatar_uid": "1bc5edb4799fd8eec67c66122f47eb73"
  },
  "project": {
    "id": "b2abd3bd2c23ff0ac546e0a2d9aa0be1",
    "name": "Translation Project",
    "slug": "translation-project",
    "main_format": "yml",
    "project_image_url": null,
    "created_at": "2025-02-07 16:18:13 UTC",
    "updated_at": "2025-02-07 16:18:13 UTC",
    "point_of_contact": null
  },
  "branch": {
    "name": "new-feature-1"
  },
  "download": {
    "id": "6a2c1a0f0c4d4f3f9b8c7e5d4a3b2c1d",
    "status": "completed",
    "result": {
      "url": "https://downloads.example.com/2025/02/07/a/b/ab12cd34ef56ab12cd34ef56ab12cd34?Expires=1739032800&Signature=example&Key-Pair-Id=EXAMPLE"
    },
    "params": {
      "file_format": "yml",
      "tags": []
    },
    "error": null,
    "created_at": "2025-02-07 16:18:13 UTC",
    "completed_at": "2025-02-07 16:18:20 UTC"
  }
}